<?xml version="1.0" encoding="UTF-8"?>

<witchhunters-guild-job:witchhunters-guild-job xmlns:witchhunters-guild-job="http://www.swordsandsorcery.com/witchhunters-guild-job"
                                               xmlns:xsi="http://www.w3.org/2001/XMLSchema-instance"
                                               xsi:schemaLocation="http://www.swordsandsorcery.com/witchhunters-guild-job ../schema.xsd">
    <witchhunters-guild-job:id>5</witchhunters-guild-job:id>
    <witchhunters-guild-job:name>Pray a tribute.</witchhunters-guild-job:name>
    <witchhunters-guild-job:description>Quest 5 description.</witchhunters-guild-job:description>
    <witchhunters-guild-job:reward>10</witchhunters-guild-job:reward>
    <witchhunters-guild-job:requirements>
        <witchhunters-guild-job:requirement type="ITEM">
            <witchhunters-guild-job:id>50</witchhunters-guild-job:id>
            <witchhunters-guild-job:amount>1</witchhunters-guild-job:amount>
        </witchhunters-guild-job:requirement>
    </witchhunters-guild-job:requirements>
</witchhunters-guild-job:witchhunters-guild-job>